name	description	url
100 Black Men of Maryland, Inc.	Programs include mentoring, education (tutorial, college access services, scholarships), health and wellness (disparities education, prostate/bone marrow, eye exams) and economic development (financial literacy).Programs include mentoring, education (tutorial, college access services, scholarships), health and wellness (disparities education, prostate/bone marrow, eye exams) and economic development (financial literacy).Programs include mentoring, education (tutorial, college access services, scholarships), health and wellness (disparities education, prostate/bone marrow, eye exams) and economic development (financial literacy).Programs include mentoring, education (tutorial, college access services, scholarships), health and wellness (disparities education, prostate/bone marrow, eye exams) and economic development (financial literacy).Programs include mentoring, education (tutorial, college access services, scholarships), health and wellness (disparities education, prostate/bone marrow, eye exams) and economic development (financial literacy).	https://google.com
Levindale Hebrew Geriatric Center and Hospital	A 292-bed geriatric hospital in Baltimore City that provides high quality inpatient, long-term care, and adult day care services to the elderly and disabled.	https://google.com
B&O Railroad Museum, Inc. (The)	Preserves the physical legacy of American railroading and the interpretation of this legacy to the widest possible audience.	https://google.com
Baltimore School for the Arts Foundation, Inc.	Formed for the purpose of providing financial assistance to the Baltimore School for the Arts.	https://google.com
Achievement Services, Inc.	Achievement services partners with Baltimore City, low-performing schools to provide extended learning in reading and math and family support services to students at-risk of academic failure.	https://google.com
Muscular Dystrophy Association - Baltimore/Southern Delaware Chapter	Fighting neuromuscular diseases through worldwide research, a nationwide network of clinics offering comprehensive medical services and far-reaching professional and public health education.	https://google.com
Maryland New Directions, Inc.	Provides career counseling, skills training and job search assistance to individuals who are experiencing serious barriers to successful employment.	https://google.com
Children's Home (The)	Serves abandoned, neglected and abused children ages 13-21, providing residential treatment services, including emergency shelter for girls and transitional programs for boys.	https://google.com
Urban Educators Foundation, Inc.	Provides activities for students and highly qualified educators to teach in urban areas by providing scholarships for educational advancement, teacher certification and continuous professional development.	https://google.com
Bello Machre, Inc.	Enrich the lives of people with developmental disabilities through loving care, guidance, and opportunity so that they can live life to its fullest.	https://google.com
Hamilton Lauraville Main street, Inc.	Building a stronger community, one business at a time.  Hamilton-Lauraville Main street is a commercial revitalization program working to restore business and jobs in Northeast Baltimore.	https://google.com
Ronald McDonald House Charities of Baltimore, Inc.	Provides a home away from home for critically ill children and their families, primarily children with cancer being treated in Baltimore area hospitals.	https://google.com
Paul's Place, Inc.	Improves life for low-income adults and children, offering hot meals, emergency assistance, health clinic, literacy/computer training, job readiness training and children's programs.	https://google.com
Myasthenia Gravis Foundation of America, Inc. MD/DC/DE Chapter	Only national non-profit health organization dedicated to the fight against MG. Provides peer support groups, toll free helpline, education material, research funding and medical referrals.	https://google.com
Epilepsy Foundation of the Chesapeake Region	Assists individuals with epilepsy achieve their goals through referral, public and professional education programs, systems assistance, support groups and scholarship program.	https://google.com
KIPP Baltimore, Inc.	KIPP Baltimore creates and operates public schools in Baltimore City that leads students from underserved communities to attend and succeed in four year colleges.	https://google.com
America's Charities	Working to build strong communities.  Addressing needs of children, families and communities through member programs, by helping employers and employees support our members charities programs.	https://google.com
American Cancer Society, South Atlantic Division	Largest funder of non-governmental cancer research. Provides services including legal advocacy for cancer patients and delivers early detection and prevention programs to youths and adults.	https://google.com
Make-A-Wish Foundation of America	We grant the wishes of children with life-threatening medical conditions to enrich the human experience with hope, strength, and joy.	https://google.com
Brain Injury Association of Maryland	Provide information, referrals, and support to individuals with brain injury, families and professionals; advocate for funding and services, coordinate education and prevention activities, promote research.	https://google.com
TurnAround, Inc.	Offers a comprehensive program to assist victims of domestic violence, sexual abuse and sexual assault.	https://google.com
Maryland Ravens, Inc.	Offers numerous opportunities for physically challenged persons to demonstrate that they too possess meaningful contributions.	https://google.com
Central Scholarship Bureau	Provides financial assistance to post secondary students through grants and non-interest bearing loans, helping students afford higher education.	https://google.com
Mother Seton Academy	An all-scholarship, independent Catholic middle school serving at-risk, low income children from Baltimore City. The school also provides after-school and summer programs.	https://google.com
National Breast Cancer Coalition Fund	National Breast Cancer Coalition is dedicated to ending breast cancer by 2020 through the power of grassroots action and advocacy.	https://google.com
Alzheimer's Disease and Related Disorders Association, Inc.	Dedicated to eliminating Alzheimer's disease through support of research and enhancing care and support for all affected.	https://google.com
Reading Is Fundamental	RIF provides free books for children nationwide and engages children, parents, and communities in reading and motivational activities to encourage a lifelong love of reading.	https://google.com
YWCA of Annapolis and Anne Arundel County	Provides comprehensive intervention, prevention services including domestic violence shelter and hotline; sexual assault hotline; legal assistance; career counseling and family services; varied youth services.	https://google.com
Associated Black Charities	Provides leadership on issues impacting Maryland's families and funding and assistance to non-profit organizations to create healthier and wealthier communities.	https://google.com
Hospice of the Chesapeake	Improves the quality of life for Maryland residents experiencing advanced illness or bereavement through hospice and palliative care.	https://google.com
Board of Child Care of the UM Church, Inc.	Provides residential care, foster care, early childhood education, emergency shelters, counseling, adoption and education services to children and families.	https://google.com
Dayspring Programs, Inc.	Housing and support services to sustain recovery from substance abuse and develop self-sufficiency of homeless families; Head Start services for preschool children and their parents.	https://google.com
Tut's Inc.	Tuttle's Place provides community-based residential foster care in a group home setting to adolescent boys, aged 8-18, in Baltimore, Maryland.  We currently provide a home to 42 boys in fine houses.	https://google.com
Institute of Notre Dame	A college-preparatory school for young women, rooted in the values of the Catholic faith and the educational vision of the School Sisters.	https://google.com
Diabetes Research and Wellness Foundation, Inc.	Our goal is to fund scientific research into the treatment and cure of diabetes.  Conducts screenings, education programs to save lives from blindness, kidney failure, and amputations.	https://google.com
Franciscan Center, Inc.	Provides emergency assistance and supportive outreach to economically disenfranchised individuals, helping them to realize their self-worth and dignity as people of God.	https://google.com
National Great Blacks in Wax Museum, Inc. (The)	Featuring over 150 life-size wax figures and a slave ship replica, we detail the African American experience from ancient Africa and slavery up to the present.	https://google.com
Mission of Mercy, Inc.	Provides free healthcare, dental care and prescription medications to the uninsured using volunteer healthcare professionals operating from a mobile medical clinic.	https://google.com
Center Stage Associates, Inc.	Engages a diverse audience of approximately 100,000 annually, featuring professional theatrical productions, enhanced by artistic educational and community programming.	https://google.com
Baltimore Chesapeake Chapter Autism Society of America	Services autistic persons and their families by providing monthly support groups, speakers, educational programs, newsletters, information and referral telephone line, additionally outreach to community groups.	https://google.com
LIGHT Health and Wellness Comprehensive Services, Inc.	Servicing families impacted by HIV/AIDS and substance abuse by providing health education, awareness and advocacy through youth and caregiver support groups, childcare and respite services.	https://google.com
Moveable Feast, Inc.	Provides nutritional support and counseling to those in Maryland who are homebound and living with HIV/AIDS and other life-challenging illnesses. Other services provided for underserved populations.	https://google.com
Garden Village Community Association Outreach, Inc.	Garden Village Community Association's main services and activities continue to address the concerns of our residents by providing youth and drug awareness programs.	https://google.com
Garden Harvest, Inc.	Provides hundreds of thousands of pounds of organic produce, eggs and soon milk solely for donation to 200 emergency food providers that feed Maryland's poorest citizens.	https://google.com
The Wilkes School at Grace and St. Peter's	The most diverse, dynamic, and joyful place to learn in the City of Baltimore for children pre-school through grade 5.	https://google.com
American Institute for Cancer Research	Funds innovative cancer research and education to expand understanding of nutrition and cancer. Baltimore CCC contributions used 100% for research and health education.	https://google.com
National Aquarium in Baltimore	More than an attraction, the Aquarium provides environmental education experiences and engages citizens in conservation projects that benefit the region's watersheds and beyond.	https://google.com
Sisters Academy of Baltimore	A tuition-free middle school, sponsored by Catholic sisters, educating girls of promise from Baltimore's inner city for excellence and leadership.	https://google.com
Grassroots Crisis Intervention Center, Inc.	Walk-in counseling; 24-hour hotlines; emergency, men's, and cold weather shelters; and transitional housing. Mobile crisis team for Howard County.	https://google.com
Alternative Directions, Inc.	Assists incarcerated/indigent individuals in Maryland with representing themselves in simple uncontested civil legal matters such as divorce, child support and visitation.	https://google.com
Notre Dame Preparatory School	A Catholic, independent college preparatory school for girls, dedicated to academic excellence, spiritual growth and social consciousness.	https://google.com
Associated: Jewish Community Federation of Baltimore, Inc. (The)	Preserves and enhances Jewish life; addresses charitable, education, religious, humanitarian, health, cultural and social service needs of the Jewish community locally and nationally.	https://google.com
Fellowship of Christian Athletes	Empowering and equipping coaches and athletes with encouragement, resources, and training to influence and impact the world for Jesus Christ for more than 55 years.	https://google.com
Assistance Center of Towson Churches, Inc.	Supplies food, clothing, limited shelter and financial assistance for prescriptions, evictions and utility turn-offs to individuals and families on an emergency basis.	https://google.com
Maryland SPCA, Inc.	Operates an adoption center for dogs and cats, accepts surrendered pets, provides educational programs for pet owners and offers community spay/neuter programs.	https://google.com
Children's Cancer Foundation, Inc. (The)	Provides grants for building facilities and research to hospitals in the Baltimore/Washington DC areas for pediatric oncology.	https://google.com
Gwynns Falls Elementary School Foundation, Inc.	Provides activities to Gwynns Falls Elementary School, which directly enhances the educational program of the student body.	https://google.com
Chesapeake Bay Foundation, Inc.	Save the Bay! We're committed to reducing pollution, improving fisheries, protecting and restoring natural resources, and building an environmental ethic in the Chesapeake Bay watershed.	https://google.com
Goodwill Industries of the Chesapeake	Provides career development, employment and related social services to assist people with special needs to enjoy the dignity and benefits of work and a better quality of life.	https://google.com
Baltimore American Indian Center	Assists American Indian/Alaska Native families with moving into an urban environment and adjusting to the culture change they will experience.	https://google.com
Christian Counseling Center of Annapolis, Inc.	Provides outpatient, professional psychotherapy services along with psychological, educational and vocational testing. Biblical principles are used in counseling where appropriate.	https://google.com
Volunteer Central, Inc.	Strengthens the community by inspiring volunteerism, connecting motivated people and businesses to non-profit organizations and creating thousands of volunteer and board opportunities yearly.	https://google.com
United Way of Central Maryland	Improves lives by helping people get and stay out of crisis and achieve a higher quality of life; and find resources 24/7 through 2-1-1 Maryland.	https://google.com
Peace of Mind Services, Inc.	We provide educational mentoring programs for at risk youth ages6-19 years old.  We also provide other services to homeless and needy individuals.	https://google.com
House of Ruth Maryland	Provides comprehensive services and shelter to victims and families of domestic violence - 24 hour hotline crisis counseling, abusers intervention, legal representation and community education.	https://google.com
Carson Scholars Fund, Inc.	Recognizes and rewards students in grades 4-11 for academic achievement and humanitarian service with a scholarship award and to establish reading rooms in schools.	https://google.com
Believe in Tomorrow National Children's Foundation	Keeping families together during medical crisis.  We provide exceptional hospital/ respite housing to families with critically ill children so they may find hope and comfort.	https://google.com
Baltimore Medical System, Inc.	Committed to improving health, wellness, and quality of life in the area's we serve by providing safe, quality accessible and affordable health care.	https://google.com
Downtown Baltimore Child Care, Inc.	Provides quality childcare/early education for parents living and/or working in downtown Baltimore. Children from 4 months - pre-K participate in full-day, year-round activities.	https://google.com
Camp Opportunity, Inc.	Promotes self-esteem and trust in at-risk children through all-volunteer one-on-one camp counseling activities.	https://google.com
Defenders of Animal Rights, Inc.	Animal rescues, pet adoption center, shelter cruelty victims, farm animals, wildlife refuge, spay/neuter, humane education, youth work, grief counseling, human health enhancement via pets.	https://google.com
Howard Community College Educational Foundation	Provides educational, scientific and charitable benefits and financial aid to qualified students attending Howard Community College.	https://google.com
Trust for Public Land (The)	Conserves land for people to enjoy as parks, gardens and other natural places, ensuring livable communities for generations to come.	https://google.com
Lance Armstrong Foundation, Inc.	LIVESTRONG fights to improve the lives of people affected by cancer, providing direct services and empowering them to take action.	https://google.com
Orphan Foundation of America	At Age 18, most orphans are on their own.  OFA and volunteers provide moral and financial support to parentless teens pursuing college and vocational training.	https://google.com
Tinina Q. Cade Foundation, Inc. (The)	Serves the needs of families battling infertility through education and outreach and provides grants for infertility treatments or adoption.	https://google.com
Bat Conservation International	Worldwide authority on bats committed to their protection through direct habitat conservation, research, and education; facilitating win-win solutions that help both bats and people.	https://google.com
Baltimore Delta Alumnae Foundation, Inc.	Provides four scholarships and SAT preparation classes for Baltimore City high school students, annual grants to schools and colleges, and summer camp for elementary school students.	https://google.com
Echo Hill Outdoor School, Inc.	Provides meaningful outdoor education experiences to over 5,500 students annually; teaches students about the environment, history and themselves through residential programs.	https://google.com
Stella Maris, Inc.	Provides services for the elderly, sick and dying including long-term care, rehabilitation, dementia care, home care, senior day care and hospice.	https://google.com
Birthright of Bel Air	Offers urine pregnancy test, information on options, education, ongoing support, community referrals and material assistance. All services are free and confidential.	https://google.com
Sheppard and Enoch Pratt Foundation, Inc. (The)	Behavioral health and special education services.	https://google.com
Archbishop Curley High School	An all-male Catholic high school that thrives to help each student in his quest to reach his academic and personal goals.	https://google.com
College Bound Foundation	Provides a college advising program that awards gap funding and scholarships, assists with college selection, financial aid forms, SAT waivers and funds and chaperones college tours.	https://google.com
Humanim	Provides workforce development, mental health, neuro-rehabilitative, residential and developmental disability services to children, adults and older adults most in need throughout Maryland.	https://google.com
